{
  "schemaVersion": 1,
  "model": "jpl-de442s-type2-float32",
  "source": {
    "release": "JPL DE442s",
    "kernelFile": "de442s.bsp",
    "kernelUrl": "https://naif.jpl.nasa.gov/pub/naif/generic_kernels/spk/planets/de442s.bsp",
    "technicalCommentsUrl": "https://naif.jpl.nasa.gov/pub/naif/generic_kernels/spk/planets/de442_tech-comments.txt",
    "byteLength": 32701440,
    "md5": "cc49327e06088124c0e39d8dde9f0b58",
    "sha256": "54d97562a5b094d298b1b8eafa5a2e17e3e010ce85e1a366d07f003ad159323c",
    "binaryFileFormat": "DAF/SPK LTL-IEEE"
  },
  "coverage": {
    "calendar": "proleptic Gregorian",
    "timeScale": "TDB",
    "startIsoTdb": "1900-01-01T00:00:00 TDB",
    "endIsoTdb": "2101-01-01T00:00:00 TDB",
    "startJulianDateTdb": 2415020.5,
    "endJulianDateTdb": 2488434.5,
    "startSecondsPastJ2000Tdb": -3155716800,
    "endSecondsPastJ2000Tdb": 3187252800,
    "endIsIncluded": true,
    "chunkYears": 5,
    "chunkBoundaryRule": "start-inclusive/end-exclusive selection except artifact end; the source record selected at each boundary is duplicated"
  },
  "units": {
    "position": "kilometer",
    "velocity": "kilometer per second",
    "recordTime": "TDB seconds past J2000.0",
    "julianDate": "TDB Julian Date"
  },
  "binaryFormat": {
    "magic": "PLDE4421",
    "formatVersion": 1,
    "byteOrder": "little-endian",
    "coefficientEncoding": "IEEE-754 binary32",
    "timeEncoding": "IEEE-754 binary64",
    "headerBytes": 32,
    "seriesDirectoryEntryBytes": 32,
    "headerLayout": [
      "0:8 ASCII magic",
      "8:4 UInt32 formatVersion",
      "12:4 UInt32 seriesCount",
      "16:8 Float64 chunkStartSecondsPastJ2000Tdb",
      "24:8 Float64 chunkEndSecondsPastJ2000Tdb"
    ],
    "directoryLayout": [
      "0:4 Int32 targetNaifId",
      "4:4 Int32 centerNaifId",
      "8:4 Int32 frameNaifId",
      "12:4 Int32 spkDataType",
      "16:4 UInt32 recordCount",
      "20:4 UInt32 coefficientCountPerAxis",
      "24:4 UInt32 dataOffsetBytes",
      "28:4 UInt32 recordStrideBytes"
    ],
    "recordLayout": [
      "0:8 Float64 midpointSecondsPastJ2000Tdb",
      "8:8 Float64 radiusSeconds",
      "16: Float32 coefficients in X then Y then Z order",
      "zero padding to an 8-byte-aligned recordStrideBytes"
    ],
    "evaluation": "position = sum(c[k] * T_k(tau)); velocity = d(position)/d(tau) / radiusSeconds; tau = (epochSeconds - midpointSeconds) / radiusSeconds"
  },
  "series": [
    {
      "id": "emb",
      "label": "SSB to Earth-Moon barycenter",
      "targetNaifId": 3,
      "centerNaifId": 0,
      "frameNaifId": 1,
      "frame": "J2000",
      "spkDataType": 2,
      "sourceInitialAddress": 2984680,
      "sourceFinalAddress": 3265574,
      "sourceStartSecondsPastJ2000Tdb": -4734072000,
      "sourceEndSecondsPastJ2000Tdb": 4735368000,
      "sourceInitialEpochSecondsPastJ2000Tdb": -4734072000,
      "sourceRecordIntervalSeconds": 1382400,
      "sourceRecordCount": 6851,
      "coefficientCountPerAxis": 13,
      "degree": 12
    },
    {
      "id": "sun",
      "label": "SSB to Sun",
      "targetNaifId": 10,
      "centerNaifId": 0,
      "frameNaifId": 1,
      "frame": "J2000",
      "spkDataType": 2,
      "sourceInitialAddress": 2251523,
      "sourceFinalAddress": 2491311,
      "sourceStartSecondsPastJ2000Tdb": -4734072000,
      "sourceEndSecondsPastJ2000Tdb": 4735368000,
      "sourceInitialEpochSecondsPastJ2000Tdb": -4734072000,
      "sourceRecordIntervalSeconds": 1382400,
      "sourceRecordCount": 6851,
      "coefficientCountPerAxis": 11,
      "degree": 10
    },
    {
      "id": "moon",
      "label": "Earth-Moon barycenter to Moon",
      "targetNaifId": 301,
      "centerNaifId": 3,
      "frameNaifId": 1,
      "frame": "J2000",
      "spkDataType": 2,
      "sourceInitialAddress": 1128078,
      "sourceFinalAddress": 2251522,
      "sourceStartSecondsPastJ2000Tdb": -4734072000,
      "sourceEndSecondsPastJ2000Tdb": 4735368000,
      "sourceInitialEpochSecondsPastJ2000Tdb": -4734072000,
      "sourceRecordIntervalSeconds": 345600,
      "sourceRecordCount": 27401,
      "coefficientCountPerAxis": 13,
      "degree": 12
    }
  ],
  "chunks": [
    {
      "id": "1900-1905",
      "startYear": 1900,
      "endYear": 1905,
      "startJulianDateTdb": 2415020.5,
      "endJulianDateTdb": 2416846.5,
      "startSecondsPastJ2000Tdb": -3155716800,
      "endSecondsPastJ2000Tdb": -2997950400,
      "file": "shared/ephemeris/de442s/chunks/1900-1905.v1.bin",
      "byteLength": 118280,
      "gzipByteLength": 107003,
      "sha256": "cea5c709268569a4a35818f4d722f983374554b4d0cf5d0874fdebde5a868f61",
      "series": [
        {
          "id": "emb",
          "targetNaifId": 3,
          "centerNaifId": 0,
          "frameNaifId": 1,
          "spkDataType": 2,
          "recordCount": 115,
          "coefficientCountPerAxis": 13,
          "degree": 12,
          "dataOffsetBytes": 128,
          "recordStrideBytes": 176,
          "firstRecordStartSecondsPastJ2000Tdb": -3156753600,
          "lastRecordEndSecondsPastJ2000Tdb": -2997777600,
          "sourceFirstRecordIndex": 1141,
          "sourceLastRecordIndex": 1255,
          "recordIntervalSeconds": 1382400
        },
        {
          "id": "sun",
          "targetNaifId": 10,
          "centerNaifId": 0,
          "frameNaifId": 1,
          "spkDataType": 2,
          "recordCount": 115,
          "coefficientCountPerAxis": 11,
          "degree": 10,
          "dataOffsetBytes": 20368,
          "recordStrideBytes": 152,
          "firstRecordStartSecondsPastJ2000Tdb": -3156753600,
          "lastRecordEndSecondsPastJ2000Tdb": -2997777600,
          "sourceFirstRecordIndex": 1141,
          "sourceLastRecordIndex": 1255,
          "recordIntervalSeconds": 1382400
        },
        {
          "id": "moon",
          "targetNaifId": 301,
          "centerNaifId": 3,
          "frameNaifId": 1,
          "spkDataType": 2,
          "recordCount": 457,
          "coefficientCountPerAxis": 13,
          "degree": 12,
          "dataOffsetBytes": 37848,
          "recordStrideBytes": 176,
          "firstRecordStartSecondsPastJ2000Tdb": -3155716800,
          "lastRecordEndSecondsPastJ2000Tdb": -2997777600,
          "sourceFirstRecordIndex": 4567,
          "sourceLastRecordIndex": 5023,
          "recordIntervalSeconds": 345600
        }
      ]
    },
    {
      "id": "1905-1910",
      "startYear": 1905,
      "endYear": 1910,
      "startJulianDateTdb": 2416846.5,
      "endJulianDateTdb": 2418672.5,
      "startSecondsPastJ2000Tdb": -2997950400,
      "endSecondsPastJ2000Tdb": -2840184000,
      "file": "shared/ephemeris/de442s/chunks/1905-1910.v1.bin",
      "byteLength": 118784,
      "gzipByteLength": 107456,
      "sha256": "24b94ab8a308ca3780d7c8286d465ef758e4820bf082189eeed92824b5045e59",
      "series": [
        {
          "id": "emb",
          "targetNaifId": 3,
          "centerNaifId": 0,
          "frameNaifId": 1,
          "spkDataType": 2,
          "recordCount": 116,
          "coefficientCountPerAxis": 13,
          "degree": 12,
          "dataOffsetBytes": 128,
          "recordStrideBytes": 176,
          "firstRecordStartSecondsPastJ2000Tdb": -2999160000,
          "lastRecordEndSecondsPastJ2000Tdb": -2838801600,
          "sourceFirstRecordIndex": 1255,
          "sourceLastRecordIndex": 1370,
          "recordIntervalSeconds": 1382400
        },
        {
          "id": "sun",
          "targetNaifId": 10,
          "centerNaifId": 0,
          "frameNaifId": 1,
          "spkDataType": 2,
          "recordCount": 116,
          "coefficientCountPerAxis": 11,
          "degree": 10,
          "dataOffsetBytes": 20544,
          "recordStrideBytes": 152,
          "firstRecordStartSecondsPastJ2000Tdb": -2999160000,
          "lastRecordEndSecondsPastJ2000Tdb": -2838801600,
          "sourceFirstRecordIndex": 1255,
          "sourceLastRecordIndex": 1370,
          "recordIntervalSeconds": 1382400
        },
        {
          "id": "moon",
          "targetNaifId": 301,
          "centerNaifId": 3,
          "frameNaifId": 1,
          "spkDataType": 2,
          "recordCount": 458,
          "coefficientCountPerAxis": 13,
          "degree": 12,
          "dataOffsetBytes": 38176,
          "recordStrideBytes": 176,
          "firstRecordStartSecondsPastJ2000Tdb": -2998123200,
          "lastRecordEndSecondsPastJ2000Tdb": -2839838400,
          "sourceFirstRecordIndex": 5023,
          "sourceLastRecordIndex": 5480,
          "recordIntervalSeconds": 345600
        }
      ]
    },
    {
      "id": "1910-1915",
      "startYear": 1910,
      "endYear": 1915,
      "startJulianDateTdb": 2418672.5,
      "endJulianDateTdb": 2420498.5,
      "startSecondsPastJ2000Tdb": -2840184000,
      "endSecondsPastJ2000Tdb": -2682417600,
      "file": "shared/ephemeris/de442s/chunks/1910-1915.v1.bin",
      "byteLength": 118280,
      "gzipByteLength": 107071,
      "sha256": "383bd66be18002fd09c29eeeb246cd30a6e5f2256ab182c8cc1202763fc76568",
      "series": [
        {
          "id": "emb",
          "targetNaifId": 3,
          "centerNaifId": 0,
          "frameNaifId": 1,
          "spkDataType": 2,
          "recordCount": 115,
          "coefficientCountPerAxis": 13,
          "degree": 12,
          "dataOffsetBytes": 128,
          "recordStrideBytes": 176,
          "firstRecordStartSecondsPastJ2000Tdb": -2840184000,
          "lastRecordEndSecondsPastJ2000Tdb": -2681208000,
          "sourceFirstRecordIndex": 1370,
          "sourceLastRecordIndex": 1484,
          "recordIntervalSeconds": 1382400
        },
        {
          "id": "sun",
          "targetNaifId": 10,
          "centerNaifId": 0,
          "frameNaifId": 1,
          "spkDataType": 2,
          "recordCount": 115,
          "coefficientCountPerAxis": 11,
          "degree": 10,
          "dataOffsetBytes": 20368,
          "recordStrideBytes": 152,